website,brand,title,content
harper's bazar,louis vuitton,Louis Vuitton's Yayoi Kusama Collection Is Back for the First Time in a Decade,"Everything Yayoi Kusama does is infinite.  In 2006, the then-creative director of Louis Vuitton, Marc Jacobs, met Kusama at her studio in Tokyo. The Japanese artist handed the designer a Vuitton Ellipse bag, hand-painted with her signature dots. Six years later, Jacobs would send similar bags down the runway, launching one of the brand's most popular artist collaborations to date.   Kusama's art—which typically features dots and mirrors—is inspired by repetition, eternity, and the illusion of a never-ending space. Her Vuitton collaboration is just as circular: Over a decade after its debut, it's back.   Today, Louis Vuitton launched the first part of its second collaboration with the artist. There are still dots (appearing on bags as hyper-realistic wet paint dabs, inspired by a Louis Vuitton trunk hand-painted by Kusama in 2012), as well as metallic studs meant to mimic the metallic orbs of Kusama's Narcissus Garden and the famous Infinity Rooms you've seen on your Instagram feed. The collection, which features over 450 pieces, isn't just bags. There's also dotted jeans, spotted Archlight sneakers, and metallized leather jackets—plus menswear, fragrances, and eyewear. The second drop will focus more on Kusama's pumpkin motif and become available in March.   Kusama has remarked that the original Vuitton collection was designed to embody the concept of ""Love Forever."" In response, Marc Jacobs noted, ""Love is a beautiful idea. The dots represent something that has no points, no hard edges and is infinite. And what could be nicer than infinite love?"" The collection was indeed released to much love from fans, and it remains loved on resale sites.   So far, Nicolas Ghesquière's take is equally well-liked—literally. Campaign images featuring Gisele Bündchen, Anok Yai, and Fei Fei Sun garnered over 1 million likes on the fashion house's instagram last month, which is nearly forty times more the average engagement per post.  Then again, this is also the first time a Louis Vuitton Yayoi Kusama collection has debuted on Instagram. Back in 2012, Louis Vuitton didn't even have an account. Still, the original Yayoi Kusama collection was Instagramable before anyone knew what that meant.  The collection and the pop-up spaces selling it—like the one in New York's Meatpacking district, with the entire store covered in floor-to-ceiling infinity dots and lined with extra-large metallic orbs—are clearly built for the social media era. Whether the response will be the same as it was ten years ago has yet to be determined, but with a new generation increasingly obsessed with archival fashion and collections of the past, the stage is set for success and plenty of TikToks.   Currently on the social media platform, Louis Vuitton's 2002 Murakami collection, emblematic of peak Y2K fashion, has Gen Z's attention. Kusama's dots, though, represent an entirely different style era defined by bow headbands and the kind of outfits Zoey Deschanel would wear in 500 Days of Summer—not necessarily the ones you'd see Paris Hilton wearing out to a club in 2004. But maybe 2023 will finally be the year whimsical 2010s fashion really does make a comeback. Fashion is as cyclical as Kusama's dots, after all.   You can shop the first drop of the new Louis Vuitton Yayoi Kusama collection here.  "
harper's bazar,louis vuitton,Pharrell Williams Is the New Men's Creative Director of Louis Vuitton,"The position of men's creative director at Louis Vuitton has remained empty since the death of Virgil Abloh in 2021. Today, the house announced that his successor will be celebrity producer Pharrell Williams. His first collection will show this June during the Men's Fashion week in Paris.The highly awaited appointment comes as a surprise to many, given that the names of designers like Grace Wales Bonner, Martine Rose, and Telfar Clemens have been swirling for months. It's one of Pietro Beccari's first big moves as the new Louis Vuitton Chairman and CEO, a position he took just two weeks ago.   In a statement, Beccari described William's appointment as a return, rather than a brand-new start: ""I am glad to welcome Pharrell back home, after our collaborations in 2004 and 2008 for Louis Vuitton, as our new Men's Creative Director. His creative vision beyond fashion will undoubtedly lead Louis Vuitton towards a new and very exciting chapter. ""  Pharrell's name has become somewhat synonymous with luxury collaborations, but his sunglasses collection with then-Louis Vuitton Creative Director Marc Jacobs in 2004 was his very first. Long time friend Abloh re-issued the colorful collection with gold details in 2018, with pairs originally retailing for $300 to $500 and then upwards of $1,700 for resale. When the shades originally dropped, Pharrell told Women's Wear Daily, ""You have to understand, I am just a regular dude. At the end of the day, this is all an incredible dream come true."" He then added, ""He is Marc Jacobs and it is Louis Vuitton, and who am I for that matter?""   Pharrell has since gone on to collaborate with Chanel and Moncler. His long-term partnership at Adidas Originals began in 2014, with his original collection featuring makeups of classic styles like the Adidas Superstar, the Stan Smith, and the brand's track jacket. Just this past November, after years of the internet making jokes about his ageless complexion (at one point, he had to publicly tell Time Out London, ""I am not [a vampire]""), he launched his skincare line, Humanrace.   He's also a fashion fan favorite, winning the CFDA fashion icon award in 2015, and his impact on style as we know it can't be understated. As the frontman of the hip-hop and rock band N.E.R.D, he shifted people's perception of what hip-hop style could be by incorporating skatewear, bold prints, and even nerdy prep classics in his look.   In 2020, Abloh told the The New York Times that Pharrell's arrival on the scene with the 2001 album 'In Search Of...' had a lasting influence on him, ""As a kid growing up in the suburbs of Chicago, skateboarding and finding my own identity, it resonated with me more than hip-hop on its own. [It said] that it was fine to be in between. And I think that has described a whole generation of young black kids and artists who have since been determined to be themselves and jump through that door that was opened by Pharrell.""   Many also consider Pharrell a pioneer of the gender-neutral clothing moment. He appeared on the cover of GQ in 2019 wearing a ballgown puffer, was the first man to star in a Chanel ad in 2017, and owns a truly envy-inducing number of pieces from Phoebe Philo's time at Céline.  Pharrell is no stranger to LVMH, the French luxury conglomerate that owns Vuitton. The Japanese producer and designer Nigo, with whom Pharrell launched the influential Billionaire Boys Club, was appointed the creative director of LVMH brand Kenzo in 2021. And Pharrell was a part of the re-brand of Tiffany, starring in campaigns after Beyoncé and Jay-Z. He recently wore a custom pair of almond-shaped emerald and diamond encrusted Tiffany sunglasses to the Grammys, and hinted to WWD that more projects were ""in the works.""     LVMH's priorities appear to be shifting, with an emphasis on creating major pop culture moments. Pharrell's influence has actually already made a viral hit for Louis Vuitton indirectly. The most recent men's show featured Spanish flamenco pop sensation Rosalía playing songs from her record-breaking album Motomami, which was produced in part by Pharrell. Her performance blew up, earning millions of views, likes, and comments on TikTok. Some critics have complained that there were more videos of the moment than of the actual clothing, but maybe that was the point: Everyone was talking about the show for days after models walked down the runway.  As of this morning, Pharrell has wiped his Instagram clean. The appointment announcement from Louis Vuitton is the only post on his page. And if one thing is clear, it's this: We're entering a new era, for both the artist and the brand. "
harper's bazar,louis vuitton,Rihanna's Baby Bump Makes Its High-Fashion Debut in Louis Vuitton Campaign,"Who else would star in Pharrell Williams's first-ever campaign as Louis Vuitton's menswear creative director but Rihanna and her baby bump?  The powerhouse duo dropped their blockbuster advertisement yesterday, which features Rihanna on a stylish coffee run while toting a rainbow stack of bags covered in the house's signature logo motifs. In the campaign, the singer wears a multitoned gray and pixelated leather button-up, which is mostly left unbuttoned, exposing her baby bump underneath. She also wears black trousers, layers of necklaces, and a glittering earring cuff.  Williams announced the mega collaboration by sharing a photo of himself posing in front of one of the billboards, blown up outside the Musée d'Orsay in Paris. In the snap, he wears a black leather biker jacket, baggy black pants, and yellow reflective sunglasses.  The campaign was released just a few days before the kickoff of Men's Fashion Week in Paris, which will be Williams's first since he was appointed as Louis Vuitton's menswear creative director in February. Williams succeeds Virgil Abloh, who held the role until his death in November 2021.  Of the musician's takeover of the house's menswear line, Louis Vuitton chairman and CEO Pietro Beccari previously said in a statement, ""I am glad to welcome Pharrell back home, after our collaborations in 2004 and 2008 for Louis Vuitton, as our new Men's Creative Director. His creative vision beyond fashion will undoubtedly lead Louis Vuitton towards a new and very exciting chapter.""  Meanwhile, Rihanna is pregnant with her and boyfriend A$AP Rocky's second child. She publicly announced the news during her historic Super Bowl halftime show performance this past February, and has since continued to dole out inimitable and innovative maternity looks—including fur coats, lace-up heels, and plenty of midriff-baring tops—so it comes as no surprise that Williams chose her to make a statement for his first Louis Vuitton campaign. "
harper's bazar,louis vuitton,Pharrell Delivers a True Pop Culture Moment at Louis Vuitton,"The livestream of Pharrell Williams's debut show for Louis Vuitton began with Pupil King, a short film by Todd Tourso. Sitting on a bench along the River Seine in Paris, wearing a black knit vest and a brown LV monogram leather cap, comedian Jerrod Carmichael asks artist Henry Taylor, ""Do you admit to yourself how bad you want it?""  Carmichael slams the back of his hand against his palm. ""Sometimes I don't say, like, truly how badly I want it.""   ""Actions speak louder than words,"" says Taylor, apologizing for the cliché. Shortly after that, models began to descend from the illuminated Pont Neuf, the oldest standing bridge crossing the river.   Williams has not said much since being named creative director for menswear by Louis Vuitton in February, a position that had remained vacant since 41-year-old Virgil Abloh's unexpected passing in November 2021. Instead, much was said of Williams. Online, fashion fans and music fans duked it out over whether a famous hip-hop multi-hyphenate made sense in one of the top design jobs in the industry. But everyone could agree the hiring indicated a shift of Louis Vuitton's focus, one that placed culture at the center.   Leading up to the show, Pietro Beccari, who was appointed CEO of the house in January, told The New York Times, ""It was important that we found someone having a broader spectrum than being a very fantastic designer, which is great for the industry and we have many of them."" Later on in the piece, Williams would go on to mention that he has no delusions about who he is and what he is capable of: ""I am a creative designer from the perspective of the consumer. I didn't go to Central Saint Martins. But I definitely went to the stores and purchased, and I know what I like.""  His first designs for the house fit this framework. Covered in the brand's signature prints and monograms, they telegraphed Louis Vuitton from a distance. But they were also imbued with a sense of impenitent joy that was paramount to the show. A handful of the first models wore tailored suits with matching shorts, a look Williams has become personally associated with on the red carpet. Others wore rain boots and carried mini trunks covered in a digitized version of Vuitton's Damier check pattern, the original of which was reimagined in jacquard and pearl embroidery throughout. The classic Speedy bag was revived in bright primary colors and dangled along long legs ending in chunky socks and lug-soled T-strap Mary Janes.   They are the kind of pieces a customer might save up for to prove to themselves and those around them that they've made it. They are bold, like the types of looks our favorite artists pull together to stand out on the red carpet. They are why ""quiet luxury"" can only ever go so far—because the pleasures of perceived opulence are far more relatable, whether anyone cares to admit it or not.   Williams is considered one of the best-dressed men in music, and his own personal style clearly served as inspiration for a handful of looks, perhaps none more obvious than that worn by former Saint Laurent creative director Stefano Pilati. Pilati's glasses were lined in pearls that framed his eyes, his tailored jacket embroidered in pearl Damier and styled with pleated wool shorts. While being self-referential can be perceived as egotistical, it doesn't feel that way when Williams does it. There's an undeniable earnestness to it, as if he's telling us: I know you want to dress like your favorite artist—and that's fine!   It's why a couple of days before his debut, he rolled out an ad campaign starring Rihanna in an unbuttoned leather button-down with her pregnant belly exposed and colorful green, yellow and red Speedy bags nestled in the crooks of her elbows. Her name trended for days after, indicating a true cultural moment—which is exactly what Williams seems to be promising to give the brand. There are plenty of designers creating works of art that reflect our reality, or gorgeous shapes that consumers want to feel on their bodies, but there aren't many who have been able to deliver these kinds of pop culture escapes. It's why today's youth are enamored with the red carpet of the early 2000s. It represents something unserious and fun: glamour without complications.  Recent Louis Vuitton designers, particularly Marc Jacobs and Abloh, have a history of providing fashion fit for the moment. Throughout his collection, Williams nodded to their work, including Jacobs's top-handle Alma bag silhouettes, which became paparazzi photo staples in the Aughts.  He created his digital camouflage print as an homage to a 2019 pixelated pattern first introduced by Abloh. And he  introduced a bit of himself, with an LVERS emblem on varsity jackets that references the ""Virginia Is for Lovers"" slogan of his home state. The bold Speedys were meant to evoke dupe culture—picture fake bags in colors you know a house doesn't produce lining the sidewalk of Canal Street. While Williams brings plenty of star power—Zendaya, Beyoncé, and Jay-Z were in the front row in Paris—there was also a sense that he wants his Louis Vuitton to be for everyone, old fans of the brand and new.  Williams also just seemed to want to have fun, with a choir at the end of the runway creating a celebratory tone. When he came out to take his bow, he brought his entire design team with him.  He spent more than five minutes on the runway, soaking in the moment with a genuine exuberance that's rare in the fashion industry. It's clear he'd been dreaming of this moment, and he wasn't afraid to show how badly he wanted it.  "
harper's bazar,chanel,Apple Martin Looks Just Like Mom Gwyneth Paltrow While Sitting Front Row at Chanel,"Apple Martin is officially a Chanel girl.  The 18-year-old daughter of Gwyneth Paltrow and Chris Martin made her Fashion Week debut today at the Chanel haute couture spring/summer 2023 show in Paris. Apple wore a black-and-white iteration of the house's signature tweed skirt-and-jacket set, which she paired with a black quilted cross-body bag and black platform loafers.  As for glam, Apple seemed to channel the '60s mod girl. She wore a fully lined eye in black and kept her layered blonde hair down with a subtle flip at the ends.  Fashion journalist Derek Blasberg commented on Apple's now viral Chanel appearance on Twitter.  ""Karl Lagerfeld met Apple Martin when she was 4 years old and declared that one day she'd be a Chanel girl,"" he wrote, captioning behind-the-scenes photos of Apple at the show. ""It happened today!""  For some fans, Apple's appearance might bear a striking resemblance to her mom, from their tall statures to their near-identical smizes. (To compare, see a photo of the Shakespeare in Love actress from the '90s below.)  Paltrow is known for singing her daughter's praises on social media. Last year, the Goop mogul even dedicated an International Women's Day tribute to the teen.  ""I've been spending the morning thinking about all of the incredible women I love, who love me back hard. I keep thinking about the women I have known since kindergarten or 7th grade, who are more strongly in my life than almost ever. But today I want to pay tribute to one (technically almost) woman on the cusp of it,"" she wrote, captioning a screenshot of the two on FaceTime together. ""This woman gives me hope for the future of sisterhood, and for the future of our planet. And this woman has made me the woman I am today more than anyone else."" "
harper's bazar,chanel,Kristen Stewart Looked Like a Doll in a White Ruffled Chanel Gown in Berlin,"Kristen Stewart is back on her Chanel style streak.  Today, the actress arrived at the Berlin International Film Festival in a princess-like gown from the French fashion house's spring/summer 2023 couture collection. The white dress featured a billowing skirt with layers of ruffles, a white bodice embroidered with designs of flora and fauna, and a gray built-in belt covered in white flowers that extended to the shoulder straps.   Stewart styled the gown with a diamond choker necklace with a pretty bow at the front, and glossy white-and-black boots. She gave the ultra-feminine look an edge with dark brows and deep red eye shadow.   While on the red carpet, the Twilight star posed like a ballerina, with her hands in front of her.  The 73rd Berlin International Film Festival is taking place at the Berlinale Palast starting today, February 16, and ending on February 26.  Stewart has been a face of Chanel for some time now.   Last May, she supported the brand at its cruise 2023 show in Monte Carlo, Monaco, alongside fellow fashion house darlings Vanessa Paradis and Tilda Swinton. For the occasion, Stewart looked like a chic party girl in a black-and-white sequined minidress with maroon and navy stripes. She paired the piece with sheer black tights and matching platform open-toe heels. Her hair was pulled back into a high ponytail, and she went for a rosy, smoky-eyed beauty look. The Spencer star's only jewelry was her engagement ring from her fiancée, Dylan Meyer.  She also wore a Chanel look to the 2022 Oscars in March. The outfit consisted of a tuxedo jacket and itty-bitty hot pants—custom-made for her by Chanel. ""It's gonna be groundbreaking,"" Tara Swennen, her stylist of 17 years, told Harper's BAZAAR before the ceremony of the unexpected yet deliciously sophisticated look. ""Definitely one of the first of its kind!"" "
harper's bazar,chanel,"Ladies and Gentlemen, H.E.R.'s First Chanel Show","Singer-songwriter H.E.R has accomplished a lifetime of major firsts at just 25 years old. Predicting she'll EGOT one day hardly feels like a stretch—she's already won five Grammys and an Oscar for Best Original Song in 2021. She's also checking off a fashion bucket list outside the recording studio, starting with attending her first Chanel show yesterday at Paris Fashion Week.  On the phone after taking in Chanel's camellia-embellished fall 2023 collection, H.E.R. told me that a Chanel invite represented a different kind of career milestone than her bevy of gold statues. She and her stylist, Wouri Vice, had spent the early days of her career ""just trying to figure it out"" and cutting up sweatsuits. ""There weren't that many brands in the beginning who looked out or supported,"" she reflects, ""and we didn't have that many options, the budgets were different.""   Attending Chanel all these years later, ""it's really just a testament to my journey and what we've accomplished and just what we've been proud to represent—it's just really, really special and it's crazy how life works,"" she says.  Chanel's latest collection was its own reflection on a first and a house code. Creative director Virginie  Viard designed an ode to the camellia, a flower that first embellished a Chanel dress in 1923 and has reliably bloomed in collections ever since. Models circled gigantic 3-D flowers that levitated over an otherwise minimal runway. Camellias reappeared across the looks clipped into models' hair, printed on dresses, and in their full form as a novelty bag with a chain handle. H.E.R. absorbed every second. ""I'm not gonna lie—I was really pleasantly surprised,"" she says. ""I think of a certain thing when I think of Chanel, but I feel a lot of the pieces were a twist on the classics."" Favorite moments from the collection spoke to her on a piece-by-piece level, including a pink boot with a black cap toe and a wide-leg jumpsuit.  The outfit H.E.R. chose to take it all in felt like its own twist on the materials and motifs that make Chanel, Chanel. She wore a slouchy coordinating cashmere and mohair sweater and wide-leg pants from Chanel's 2022/2023 Métiers d'Art collection, with a red flap bag, red platform heels, a Coco Crush ring, and Chanel fine jewelry.   ""It's very much ‘70s rock star, which I reference a lot,"" H.E.R. explained. ""I look at Hendrix or Janis Joplin or Sly Stone and that's usually my inspo. Immediately, this look kind of screamed that."" Adding sunglasses, strands of chunky necklaces, and wavy curls for show day, the whole outfit just ""clicked.""   ""Easy,"" ""cozy,"" and ""chill"" are words I notice H.E.R. using to describe her outfit and the atmosphere at the show itself. Forget any preconceived notions about a buttoned-up Paris runway. Ephemeral energy is hard to translate into words, but this is how H.E.R. captured the mood: ""It was very balanced, very elegant, very classy. Everybody is like, just honored to be there. You know? That's at least how I felt.  Nobody's like, trying anything. They're just happy to be there and just want to appreciate the clothes and appreciate the show.""  ""Everyone"" includes Zoe Saldana (""She kind of came up to me, which was really nice. We had been on a plane together one time so we were laughing about that"") and FKA Twigs (""Who I love, and we got to chop it up a little bit""). And, most notably to H.E.R., the models.   ""I really want to commend Chanel for the representation of all of these models that come from different backgrounds, different sizes, different skin tones, all different hair styles— it was such a diverse group,"" she says. ""I thought that was really, really exciting to see and also added to the vibe of the room.""  ""Nothing felt intimidating,"" H.E.R. summarizes. ""Even though it is Chanel, it was very warm for me, and that's what I really loved about it."" All the makings of another memorable first.  "
harper's bazar,chanel,Penélope Cruz's Playful Take on the Classic Tweed Dress Includes Feathers,"If you think dressing up in tweed is boring, allow Penélope Cruz to prove you wrong.  The Academy Award-winning actress made a dazzling appearance to sit front row at Chanel's fall/winter 2023–24 runway show during Paris Fashion Week. As an ambassador of the iconic French luxury house, Cruz wore its signature tweed—with a playful twist.  Her tweed blazer dress embraced a feminine silhouette, with its deep V-neckline and flared miniskirt. Wispy white feathers tinged at the ends with hot pink or canary yellow adorned the bottom half of the dress, adding a colorful dimension to the navy blue piece. Other details included silver bejeweled buttons and a ruched black belt with a silver crystal buckle.  Cruz let the statement dress shine by keeping the rest of her ensemble to a classic black color palette, carrying a quilted Chanel purse with a gold chain strap and wearing glossy pumps.  The actress is known for making fashion statements while clad in Chanel.   For instance, she attended last year's Tribeca Film Festival wearing a glistening one-shoulder evening gown from the brand. Sparkling black sequins covered the dress, and she further accessorized with the house's iconic quilted clutch, peep-toe heels, and a gold-and-diamond choker interwoven with black leather featuring Chanel's double-C logo.   On another occasion during the cinema festival, Cruz wore a hot pink Chanel look, consisting of a floor-length slipdress emblazoned with a square geometric pattern and a hot pink quilted box bag to match. "
