website,brand,title,content
elle,chanel,"Chanel Hits The Gym, Beach, And Red Carpet","The team at Chanel has been busy, to say the least. Between staging the Met's new Costume Institute exhibit honoring Karl Lagerfeld, longtime creative director, dressing a bevy of stars including house ambassadors Penélope Cruz and Blackpink's Jennie for the Met Gala, and opening a brand-spanking-new 30,000 square-foot store in Beverly Hills, the quintessential French brand has been living the American dream this month. For their resort 2024 show, they stayed on the west coast to present a Venice-meets-Left Bank collection that relied less on stereotypical ""Hollywood"" aesthetics and more on capital-f Fun.   Guests including Marion Cotillard, Kristen Stewart, and Margaret Qualley were treated to a staging of epic proportions at Paramount Studios, one that gave a slight nod to Lagerfeld's penchant for dramatic, sweeping sets, yes, in Los Angeles, but also Cuba, China, and of course at the Grand Palais. A typical movie set lot was transformed into a massive roller rink, replete with double Cs and a scoreboard that had a running list of the models, almost announcing them like players on a starting lineup.   Since taking the creative reins in 2019, Virginie Viard has softened the Chanel woman and  embraced femininity. She upped the ante for this show, maybe taking inspiration from Karl's dramatic flair, but definitely taking cues from the laid-back, over-saturated energy of LA in the 70s and 80s. Hair was blown out to epic proportions, harkening back to iconic 90s Chanel shows, and makeup was sun-kissed and minimal, as the Hollywood starlet only needs a swipe of blush and some sunscreen.   The show started out with nary a tweed suit in sight, but rather skin-tight, sexy as can be swimsuits styled to the nines with jewelry, leg-warmers, and sneakers, leaning unapologetically into the Jazzercise craze. Neon-bright prints, ombré metallics and pastels appeared on richly detailed tweeds, lurex bodysuits, and casual shorts fit for lazy beach day. Breezy silks in solid colors were layered under miniskirts, and shiny tracksuits looked like something Jamie Lee Curtis' character in Perfect would have worn after teaching aerobics. The footwear even included block heeled sandals with light-up heels, making sure each girl had a personal spotlight. Every LA girl we know and love, from the Santa Monica skater girl to the Barbie-core Rodeo Drive princess, was present, with Viard casting her net from the PCH to Sunset Boulevard.   It felt like Viard was letting her hair down for the first time, stacking on shiny bangles and plenty of bags, and with them, a brand new attitude entered the room. The typical Hollywood golds and blacks didn't make their way into the collection til the very end, with a more mature ending of wrap dresses and embroidered tweed jumpsuits that didn't sacrifice glamour or camp. We can't help but wonder which saccharine pink and gold palette looks Margot Robbie might wear for her upcoming Barbie press tour. She's got quite the wardrobe to pick from.  "
elle,dior,Robert Pattinson Looks Chic In Tweed Skirt at Dior's Paris Fashion Week Show,"On Friday, January 20, Robert Pattinson was one of the highlights at Dior's Homme fall/winter 2023-2024 show during Paris Fashion Week. The Batman actor was looking very chic in brown and gray, with a fuzzy fleece-texture zipper jacket over a turtleneck in the same shade.  Underneath, he wore a pleated, navy tweed skirt that revealed his knee-high black boots. His hair looked almost wet, with soft curls falling over his forehead. Pattinson has worked with Dior for almost ten years, and is a Dior fragrance ambassador, working with the fashion house as they relaunch Dior Homme Sport.  Pattinson has been in the entertainment industry for decades now, and has spoken openly about how there is a very restrictive standard for men's bodies in his field. He told ES Magazine in an interview published the day before the Dior show that these ideas about men's physicality can get to anyone, adding, ""Yeah, it's crazy. Even if you're just watching your calorie intake, it's extraordinarily addictive. And you don't quite realize how insidious it is until it's too late.""  It is particularly disturbing to him how this trend influences the perception of young boys about their bodies and their relationship to exercise and eating. The actor claimed, however, that he is comfortable with his own body image, but has ""tried every fad you can think of, everything except consistency.""  He continued, ""I once ate nothing but potatoes for two weeks, as a detox. Just boiled potatoes and Himalayan pink salt. Apparently, it's a cleanse...And I tried to do keto once. I was like, ‘Oh, there's a diet where you just eat charcuterie boards and cheese all the time?' But I didn't realize you can't have beer as it completely defeats the purpose.""  "
elle,dior,Dior Beauty's Eyeliner Has A Playlist,"Not all eyeliner looks are worthy of a soundtrack, but Dior has one for you. Cue up Edith Piaf's Non Je Ne Regrette Rien, some songs of moody French chanteuse Juliette Gréco, and you'll be inspired to try an eyeliner look that's melancholic, strong, defiant, and a little bit punk. (Maybe Lana del Ray's Sad Girl would fit in here too).  At the Dior FW23 show, models wore black eyeliner and even more black eyeliner. It was blurrily smudged into the inner and outer corners of the eye and purposely exaggerated both above and below the lash line. ""It's like a deconstructed combination between a smokey eye and eyeliner,"" Peter Philips, Creative and Image Director for Dior Beauty.  Maybe a ""smoliner"" look, if you will. If you've never been able to fully master the gradation that comes with a flawless smoky eye or the perfection of a tight line, great news, because this look was neither of those things (there was also no contouring or highlight, so don't worry about those either).   Juxtaposed against the rich floral textiles, shine, and sculptural set that Portuguese artist Joana Vasconcelos created,  this season's beauty look was meant to stand out. ""We wanted to do a look where the girls don't disappear,"" Philips said. ""The idea was not to have a gorgeous smokey eye."" Or maybe you're thinking it's a little Wednesday Addams-core? ""It's melancholic 60's, Saint Germain, and there's a little sadness but also strongness."" The eyeliner (Dior Crayon Eyeliner Waterproof) was drawn and blended to go down a bit at the end of the eyes to create a moodier effect. For extra intensity, he used black eyeshadow (Dior 5 Couleurs Couture in Black Bow) and stamped additional color on it to make the look even blacker. No mascara (""It would look too sexy, almost, too sensual.""), a nude lip, and softly brushed brows rounded out the look. For a last touch -- models also degreased their T-zone, thanks to a bit of logomania. Philips showed off a book of sheets printed with ""Dior,"" the brand's blotting papers, giving a sneak peek into an upcoming new launch. Since public blotting is having a moment, thanks to Rihanna, these will surely have their TikTok moment in the future on your ""For You"" page.   To complete the full look, Guido Palau and his hair team then added low ponytails gathered at the nape of the neck, finished with thick black headbands with crinkled ribbons attached.  For added gleam and fullness, he blew hair away from the face using Oribe Thickening Spray and Oribe Supershine Light Moisturizing Cream.  "
elle,dior,Kim Jones Designed Sneakers for Hennessy—Even Though He Doesn't Drink,"Chances are, Kim Jones made your favorite sneakers—or at least, they would be your favorite, if they hadn't sold out in five seconds. He's the artistic director at Dior Men and the brains behind the ""Air Dior"" Nikes that literally broke the brand's website, plus collabs with Converse, those coveted skate slip-ons at Louis Vuitton, and that monogram pair with Supreme that's only available in limited stock on The RealReal. (If you're more into heels, don't panic. Mr. Jones is also in charge of Fendi's womenswear collection, where these stratospheric boots are currently going fast.)   Now, in an unlikely partnership, Jones is joining forces with Hennessy, the prestigious French cognac brand that's technically older than America. (It was founded in 1765, but alas, was never name-checked in Hamilton.) The main caveat? Although Hennessy X.O is an exquisite pour, Kim Jones doesn't drink. Ever. ""I'm really allergic!"" he laughs when I ask him if he did any sip-and-sketch rounds for his sneaker designs. ""I wanted to try it because I wanted to see why everyone was so obsessed by it, but you know, it just doesn't agree with me."" Instead, Jones used the classic brandy's rich brown color story. ""And since drinking Hennessy X.O is part of both formal and casual gatherings, it was really important for [the sneakers] to fit into any wardrobe in a different way."" Jones also created a decanter and bottle for the cognac, which is—surprise—owned by the same parent company as Dior itself.  When most people buy a bottle of Hennessy, they probably drink it (or at least gift it to someone special). But when they venture to buy a coveted Kim Jones sneaker, they might try and flip it for double the value instead. Is Jones cool with that? ""I've seen a lot of my friends' kids do that, actually! I think some of them have made loads of money,"" he laughs. ""But then they take that money and buy more sneakers, or other clothes they really want. To be honest, at that age, I didn't have that kind of ingenuity. So those guys? My hat's off to them.""   Ironically, instead of flipping streetwear in his youth, the 49-year-old designer served drinks ""at an opera house bar"" instead. ""I had to work to get through college, didn't I?"" he asks. ""But it was amazing, actually. You met opera singers, you met people that design sets, you met aristocracy, you met all sorts...but I did notice the people who ordered Hennessy always had really nice suits, watches, jewelry…I can't say I didn't think of them when I was creating these pieces."" One day at work, Jones served the Queen Mother. Two decades later, he was appointed an Officer of the British Empire by Queen Elizabeth II.  As a failed multitasker, I ask Jones how he keeps up with his two big day jobs—at two big-name fashion houses—along with various collabs (Tiffany & Co., Marc Jacobs, and BTS, to name a few), plus the normal stuff like eating, sleeping, and hanging out with Kate Moss. ""Oh, I can help you there,"" he starts, before adding, ""you just have to be incredibly organized."" Seriously? That's it?   ""And, okay, you need to be sure of what you're setting out to achieve. Where we start on the [Fendi] collection or where we start at [Dior], we know we're headed to an end product. And that end product is really how I've been imagining it to look all along. That goal never changes."" But Jones cautions that his singular focus can't happen alone. ""When you're working with a team that's already been at a brand for a while, you have to teach people what you want,"" he says. ""It takes time to work with an entity and a team of people. Trust, and time. And you have to be straightforward with people about that upfront. There's nothing wrong with saying, ‘This will be hard work, and we can't rush through it.' Everything good takes time."" Including Hennessy's new cognac, which takes an average of 45 years to mature.  Could abstaining from drinking be the secret to Jones' youthful glow? Even via Zoom, it looks like his complexion is powered by a ring light. Perhaps a skincare collaboration is in his future? ""I've been approached by most of the big beauty makers,"" he admits. We'll cheers to that, even if Jones won't.  "
elle,dior,Jisoo Gives a Behind-the-Scenes Look at Dior's Winter 2023 Show and Her Visit to the House's Archives,"Blackpink's Jisoo returned to Paris last month for Christian Dior's fall/winter 2023-2024 show, but she did more than just sit front row. The K-pop singer and house ambassador spent the day before the runway show learning more about Dior's history—and the women who most inspired Christian Dior, including his sister Catherine—during a private visit to the house's archives, known as Dior Heritage.   In the video above, shot by Melina Triana and Benjamin Vu and exclusively premiering on ELLE.com, Jisoo takes fans behind the scenes of her Paris visit and her intimate tour of the house's archives and history. ""I can't wait to see which archive pieces will be referenced by [Creative Director] Maria Grazia Chiuri in her collection,"" Jisoo said.  Jisoo, who has an older brother and sister, was particularly moved by the story of Catherine Dior, who inspired Miss Dior. ""The story of Christian Dior's younger sister Catherine was very emotional,"" Jisoo reflected, after learning her story and seeing photos of her. ""She had a tough life but the fact that she found the strength within to rebuild her life really impressed me. I'm excited to see Maria Grazia Chiuri's work inspired by Catherine Dior's story.""  ""One can believe Christian Dior was the main character of the house of Dior, but I got to learn that he actually had many exceptional women by his side,"" she continued. ""I was very moved hearing the stories of these characters who are not well-known.""  Jisoo learned that her favorite flower, lily of the valley, has important an significance to Dior, too. She was able to view a couple archival dresses that featured the flower in their print and design.   Of the show itself the next day, Jisoo gave a glowing review, saying, ""That was yet another spectacular collection by Maria Grazia Chiuri. The pieces inspired by the flower prints I saw yesterday in the archives were particularly fascinating. Once again, I loved this unforgettable experience with Dior. See you soon in Paris!""  Watch her full diary above, and look through intimate photos of her Dior Heritage visit, taken by Pierre Mouton, below: "
elle,versace,Gigi Hadid Climbed a Parking Garage for Versace,"""Versace is always the dream,"" says Dua Lipa. She is sitting on the roof of a parking garage in Los Angeles, surrounded by a thrumming crowd of fashion editors bleary from the Paris runways, stylists taking a break from their A-list clients for the upcoming Oscars, and K-Pop princes in popsicle-colored suits. Elton John zips by in a golf cart. The sun is about to set.  It's almost golden hour and go time for Versace's fall/winter 2023 show, which moved this season from Milan to Melrose Place, and harnessed the way everyone in Hollywood is chasing clout—fame, power, art, or even just sheer attention—while trying (or at least claiming) to stay grounded. If la-la land is merely an illusion, it's one with real stakes and true emotions lurking just beneath its glossy surface. Fashion straddles a similar line between fantasy and reality: it skips between our very real bodies and our very big imaginations. And because she's una specie di genia—that's ""kind of a genius"" in Italian—Donatella Versace has managed to make clothes for every girl, everywhere, all at once...even the girls who just live in our heads.  First, there was Gigi Hadid's opening look: a black power suit and slashed-pocket peplum that straddled the line between CEO and celebrity. (When it crossed Paris Hilton's field of vision, it became a living meme for ""get you a girl who can do both."") Croc-embossed miniskirts and tweed cocoon coats were firmly rooted in the reality of working women, while a few micro mini poufs (including one on Kendall Jenner) were part of the ""no pants, no problem"" trend and likely a revenge breakup post waiting to happen. In between were tons of options, both practical and dreamy—leather trenches, 3-D floral fabrics, goth-lite babydoll dresses—that towed Versace's assertively sexy party line, as in, ""You're wearing a Versace, you'd better go party.""  Like the California Dream itself, the show ended in a fantasy…and then again in a reality. The L.A. skyline became a purple haze, and Versace took her runway bow, wearing the same dress Emily Ratajkowski donned in the show. Prince's ""Let's Go Crazy"" blared through the speakers, and Anne Hathaway screamed every lyric in a glorious karaoke moment for the ages. Waiters circled with champagne and tiny pieces of avocado toast. Everyone took selfies, especially Tan France.  Next, the crowd of very famous stars realized they were on top of a parking garage at rush hour, and in mere seconds, transformed into impressively pragmatic people. Demi Moore led the charge to the elevators, Pamela Anderson navigated a steep staircase in pencil-thin stilettos (""I've been doing this a while!"" she laughed), and Miley Cyrus huddled with stylist Patti Wilson behind a valet station until the actual valet returned with their car. Cyrus' two-tone gown looked just as good in the ghastly fluorescent lighting—another nod to Signora Versace's skill at making glamour very real, even when surrounded by everyday grime.  Oh, one more thing: the Versace show was held on Barbie's birthday, and just a few miles up from her hometown of Malibu. There was no official tribute, but with eight bright pink looks on the catwalk and a series of satiny pink bags and shoes, it seems Barbiecore is definitively here to stay—at least until July, anyway, because that's when the movie comes out. Coincidentally or not, that's when these clothes do, too.  "
elle,versace,Give Anne Hathaway an Award For This Versace Look,"Anne Hathaway is back at it again, proving she's red carpet (in addition to Genovian, of course) royalty. At Versace's Fall/Winter 2023 show in Los Angeles, the actress delivered a killer all-black ensemble. The outfit: a Versace crocodile-effect minidress, sheer tights, sky-high platform boots and sunglasses, and sparkling Bulgari jewelry. The dominatrix-style set would do her Catwoman character proud.   Hathaway was joined by other big celebrities at the Versace show, including Lil Nas X, Miley Cyrus, Ariana DeBose, Elton John, and Dua Lipa.   Later that day, Hathaway stepped out in a different black dress (also Versace) for the Hollywood Beauty Awards. This one was long, slinky and gown-like. The dress had beautiful detailing, like gold buckle Versace Medusa straps. ""I'm at a point in my life now where I know having a first time at something remarkable like that—it's the only time it ever happens,"" Hathaway recently told ELLE. ""Being in a place where I could enjoy it felt like a really positive development.""  Hathaway has four feature films slated for release in 2023, including Mothers' Instinct alongside her friend Jessica Chastain. She also gained critical acclaim last year for her incredible performance as Rebekah Neumann in WeCrashed on Apple TV and Esther Graff in Armageddon Time. ""I have worked too hard on seeing myself with kinder eyes to give away my peace to those who haven't found it for themselves yet,"" Hathaway told ELLE. ""So I do my best to not be afraid of what others might say and just focus on enjoying my life."" "
elle,versace,Anne Hathaway Wore a Versace Dress With an Epic Leg Slit to the 2023 Met Gala,"Anne Hathaway might not have shown up to the Met Gala in Andy Sachs' Chanel boots, but she channeled Karl Lagerfeld in her own way—with the help of Donatella Versace, in fact. The Devil Wears Prada star looked breathtaking in a strapless safety pin dress by Versace, designed à la Lagerfeld with white tweed, pearl accents, and camellia flower details.   ""It was meant to be a marriage between Versace and Chanel,"" Hathaway, who is the new face of the Italian fashion house, said of her dress in a red carpet interview with Vogue. A pair of fingerless gloves, platform heels, and Bulgari jewels completed her look.   The ensemble was equal parts sophisticated and sexy, thanks to the safety pin cutouts and the major leg slit, which technically slices across the whole length of the gown. Hathaway even gave a quick tutorial for how to pose in the look during her livestream interview. ""There's just something about this dress that makes you kind of want to hit it,"" she said, popping out one hip and lifting her chin up high. ""Get a little Rosalía going on in your head and live in the fantasy.""  Hathaway credits her stylist, Erin Walsh, for collaborating with Versace on the look. ""I just do what Donatella tells me to do, very gratefully,"" the actress said. ""She sent me a sketch for this and I just went, ‘Well, alright!'""  The same attention to detail went into her beauty look for the night. She pointed out that her hairstylist, Orlando Pita, pinned a camellia from a Versace show in the '90s to her hair, completing her voluminous half-updo. From hair to heels, Hathaway's complete look is enough to wow Miranda Priestly herself. "
elle,versace,Dua Lipa Wore a String Bikini From Her Versace Collaboration—Her ‘Summer Outfit Until Further Notice',"Only Dua Lipa could make a bathroom look so gorgeous while flaunting her own designer collaboration. The singer took to Instagram to show off a polka dot string bikini adorned with butterflies from her and Donatella Versace's La Vacanza collection. ""My summer outfit until further notice 🦋🦋"" Lipa wrote. ""The cutest @versace polka dots bikini from my #VersaceLaVacanza collection with @donatella_versace.""  Versace commented on Lipa's post, sharing, ""An absolute BEAUTY!! This summer is ALL about La Vacanza @dualipa 🦋☀️✨""  Lipa and Versace first unveiled their collection last month. Lipa shared footage of the runway show on May 24, writing, ""Feeling overwhelmed with happiness and still taking in last night! Creating this collection with my dear dear friend @donatella_versace has been the most incredible insightful and inspiring process that I feel so lucky I got to experience. I want to thank the whole @versace team for holding my hand through this!! Thank you @kjeldgaard1 @patmcgrathreal @guidopalau @piergiorgio @pat_boguslawski @dannylharle @holmesproduction and all the incredible models that gave us a show to remember!!! I feel like the luckiest girl in the world 🦋🦋🦋🦋"" Over 1.4 million people liked the Instagram post.  Lipa's collection with Versace has garnered celebrity admiration in addition to public fandom. Bridgerton actress Simone Ashley gave Lipa a shout-out when speaking to ELLE.com at the Veuve Clicquot polo classic in New York City about who her fashion inspirations are.   ""I love Dua Lipa's collaboration with Donatella [Versace],"" Ashley said. ""It was really inspiring.""  Lipa has more projects this summer. The singer will be playing multiple mermaids in the Barbie film out next month. She also recorded the lead single for the soundtrack that she released in late May, ""Dance the Night Away.""   When the song dropped, she shared a teaser of the music video, writing, ""I wrote this song with my friends @iammarkronson @wyattish @carolineailin and we hope you LOVE IT! Barbie out in cinema's July 21st!!!! 💕🪩"" "
