website,brand,title,content
glamour,louis vuitton,Zendaya’s Simple Styling Hack Gave Her Louis Vuitton Look a Sexy Update,"A multitude of stars were out last night in Paris to witness Pharrell Williams's highly anticipated debut as creative director at Louis Vuitton men's. Among them, naturally, was brand ambassador Zendaya, who commanded attention in a dazzling outfit.  The Euphoria actor hit the step-and-repeat before taking her place on the front row, wearing a shimmering ensemble from Louis Vuitton's cruise 2024 collection, designed by womenswear creative director Nicolas Ghesquière. The look featured an eye-catching sequined shirt (unbuttoned to the navel), matching flared trousers, a black leather Capucine handbag, and brown patent leather pumps. Enhancing the overall vibe, the star adorned herself with Bulgari jewellery, including gold, diamond, and sapphire pieces.  A close-up of Zendaya's sequin moment  Louis Vuitton cruise 2024  In addition to Z, power couples such as Jay-Z and Beyoncé, as well as A$AP Rocky and Rihanna (the Fenty founder is the face of Pharrell's inaugural campaign for the brand, launched a few days prior), were in attendance, joined by notable figures like Lewis Hamilton, Naomi Campbell, and Kim Kardashian. The front row was brimming with personalities, all dressed head-to-toe in the latest LV.   Pharrell took the helm at Louis Vuitton following the passing of Virgil Abloh, and his debut show for spring-summer 2024 took place on top of the Pont Neuf, symbolising a figurative bridge between his hometown in Virginia and his new home in the French capital. Alongside upholding Abloh's legacy and finding inspiration in pivotal moments from his own life, Pharrell delved into contemporary interpretations of the iconic LV Damier pattern. With his roster of A-list friends and collaborators, we can only anticipate more star-studded affairs orchestrated by the newly appointed creative director—and Zendaya showing her support in yet more striking looks.  This article first appeared on British Vogue.  "
glamour,chanel,Kristen Stewart Goes Braless in Sheer Chanel,"Kristen Stewart is closing out the 2023 Berlin International Film Festival with a bang.  On February 25, the 32-year-old Berlinale jury president arrived on the red carpet for the festival's closing ceremony in a sheer Chanel gown with knitted black accents, including strategically placed pockets. She wore the bold look over a pair of high-waist black undergarments, opting to walk the carpet sans bra, and topped off the look with a pair of Chanel booties.  Despite the ensemble's elegant design and delicate details, Stewart's overall vibe was positively grunge with a rusty smoky eye and her tousled chocolate mullet and micro bangs.   Kristen Stewart arrives for the closing ceremony of the 73rd Berlin International Film Festival.  Stewart debuted the choppy style at Chanel's spring-summer 2023 show in Paris, courtesy of celebrity hairstyles and Virtue Labs creative director Adir Abergel.  Another look at Stewart's outfit  ""It's such a rare indulgence to be able to talk about the thing you're obsessed with—which in my case is movies—when you're not promoting it or making one,"" Stewart said of her appointment as jury president at a press conference towards the beginning of the festival, per Screen Daily. ""It wasn't my decision to be here. I was shocked that they called me; it's an enormous opportunity to have a hand in highlighting beautiful things in a time where that's hard to hold. It's the job of an artist to take a disgusting and ugly thing and transmute it, put it through your body, and pop out something more beautiful and more helpful. Something considered and not something knee-jerk reactive.""  She continued, ""We're living in the most reactive, emotionally whiplashed time. To sit and have a moment to digress and see what people have pumped out of their own bodies—that was an opportunity I couldn't say no to."" "
glamour,chanel,Kristen Stewart Wore See-Through Chanel Shorts to a Pre-Oscars Party,"Kristen Stewart's latest sheer Chanel ensemble is a subtle nod to last year's Oscars look.  On March 11, Stewart arrived at Chanel's pre-Oscars dinner in Beverly Hills wearing black knit shorts and a matching top with sequins and a sweet silver bow detail. As the 32-year-old actor is wont to do, she gave the elegant brand a grunge update with her choppy brunette mullet and smudged black smoky eye, topping off the entire look with a pair of black lace-up boots and white crew socks.   Clearly, Kristen Stewart, who has been a Chanel brand ambassador for many years now, has fully embraced shorts as a formal wear staple. On March 28, 2022, the Spencer actor attended the Academy Awards in a classic black suit with short shorts and an unbuttoned white dress shirt, quickly ditching her high heels for a pair of socks and loafers. ""When you pick a dress from the runway, you feel like you need to do it justice,"" she told Vogue at the time. ""This felt the other way around.""   Kristen Stewart attends the 94th Annual Academy Awards at on March 27, 2022.  ""It was the one opportunity to be me. I didn't want to feel placed in an outfit—I wanted to feel an elevated elegance, and [like it's a] second skin,"" she said of the look. ""The right way to do this was to lean into ‘less is more,' and allow yourself to stand in your own skin rather than put on an armor.""  The 95th annual Academy Awards will air on March 12 at 8 p.m. ET on ABC and will be available to stream on Hulu Live TV, YouTube TV, AT&T TV, and FuboTV. You can also watch on abc.com and the ABC app by authenticating with your provider. For everything else you need to know about the Oscars, click here. "
glamour,chanel,Kim Kardashian Dipped Into the Chanel Archives Ahead of the Met Gala,"When it comes to archival fashion, Kim Kardashian is a devoted collector of some of the most sought-after pieces. From Alexander McQueen's infamous spring-summer 2003 ""Oyster dress"" to the ultrarare autumn-winter 1990 Azzedine Alaïa cheetah-print bodysuit, the entrepreneur's personal archive is an impressive collection of important fashion pieces.  Kim Kardashian.  For her latest red-carpet appearance at the Time 100 Gala, she delivered another vintage look, wearing an ivory satin John Galliano slip dress with jeweled straps and a perfectly snatched waist. It's an unusually simple choice for Kardashian, but she added drama via layers of crystal necklaces, with pieces from Bulgari, Messika, and XIV Karats. However, the standout feature of Kardashian's look was her pearlescent Chanel clutch bag, a rare item designed by the late, legendary designer Karl Lagerfeld.  Kim Kardashian carries a Chanel conch bag.   First seen on Chanel's spring-summer 2012 runway (notably the spectacle where Florence Welch arose like Botticelli's Venus from a half shell to perform ""What the Water Gave Me""), the conch-inspired piece was integral to the oceanic theme of the whole collection. While the little seashell-shaped bag isn't currently available to purchase anywhere, avid collectors are certain to be able to source the piece from luxury resale sites like 1stDibs, Vestiaire Collective, and Farfetch Second Life, to name a few.  Chanel's spring-summer 2012 fashion show during Paris Fashion Week on October 4, 2011, in Paris.  If anyone needs a reminder, next Monday the annual Met Gala will honor Karl Lagerfeld's brilliant career, and the dress code for the event is ""in honor of Karl."" Kardashian's exploration of the Chanel archive may be a sign of what we can expect from her appearance on the famous steps of the Metropolitan Museum and a signal that she has been doing her fashion history research.  This content can also be viewed on the site it originates from.  Kardashian always takes her Met Gala outfits very seriously, and today she shared on Instagram pictures of her at Karl Lagerfeld's office in Paris ""getting a little inspiration for the Met."" In the pictures she examines original sketches and lies on a bed with Karl's cat Choupette, plotting for her next Met Gala triumph.  This article first appeared on British Vogue. "
glamour,chanel,Margot Robbie Wore a Slinky Gold Chain Vest Over a Black Bikini Top at the Chanel Show,"Margot Robbie was in festival mode at Chanel's cruise show on May 9, staged at Paramount Studios in Los Angeles. Joining Kristen Stewart, Paris Hilton, Sofia Richie, and Elle Fanning (among others) on the front row, the actor put a luxe spin on festival fashion in denim flares, a triangle bikini top, and a bejeweled vest, constructed from double-C charms and the maison's trademark leather chains. Coachella-ready fanny pack? Not for Robbie, who opted instead for a quilted top-handle stamped with the Chanel logo.  The actor rocked beachy waves on the front row at Chanel's Resort 2024 cruise show.  For added Coachella effect, the actor wore her signature beachy blonde waves in a '70s-inspired tousled style. She also kept her makeup low-key, with subtly lined eyes, blush, and a rosy lip.  Not mad about it!  The look echoed the LA-inspired collection that Virginie Viard debuted at the ""one night only"" event, which saw models take to the catwalk in bodysuits, leg-warmers, and wedges. ""I thought, Let's do Jane Fonda, Cindy Crawford—all our heroines,"" Viard said ahead of the showcase. Margot Robbie likely kept a close eye on the offering, given that her Barbie press tour is imminent—the pink looks, in particular, deserve a moment on the red carpet.  This article first appeared on British Vogue.  "
glamour,dior,Blackpink’s Jisoo Channeled Audrey Hepburn at Dior,"Blackpink's Jisoo has been a Dior devotee for a while now. In 2021 she was appointed a global ambassador for the house for both fashion and beauty, and has been a regular on the front row at Dior shows ever since.   The inspiration for Maria Grazia Chiuri's spring-summer 2023 couture collection was Josephine Baker, but Jisoo channeled Audrey Hepburn on the front row, sporting a wispy fringe, a neat bun, and a feline flick that was reminiscent of the actor's signature look.   Jisoo attending Dior's spring-summer 2023 couture show.  Creative and image director of Christian Dior makeup Peter Philips was behind the nostalgic beauty look and also oversaw the makeup on the runway. Meanwhile, the Blackpink musician's chosen outfit—a white dress with a sheer shirt beneath from Chiuri's autumn-winter 2022 couture show—echoed Hepburn's penchant for elegant, feminine silhouettes and a monochrome palette.   Accessories-wise, the singer was one of several guests carrying the maison's iconic Lady Dior bag, a style loved by the late Princess Diana, who was regularly seen with the patent black and navy versions hooked over her arm. Jisoo's Lady Dior, however, was scaled down in size—big enough to fit only the essentials (purse, phone, lipstick).   This post was originally published on British Vogue. "
glamour,dior,We Tried Dior Beauty’s Addict Lip Maximizer Gloss and It’s a Y2K Dream,"When TikTok becomes obsessed with a product, there's no escaping it. Few products have reached viral holy grail status, but Dior Beauty struck gold last year with its famous Lip Glow Oil, which seemed to be all over our feeds and became impossible to find in stock. Now the brand has done it again with the new and improved Dior Addict Lip Maximizer lip gloss, a revamped version of the original beloved formula, videos of which have already racked up 22.1 million view on TikTok.   It's no surprise that Dior Beauty created another obsession-worthy lip gloss that checks off all the boxes: high shine, hydrating ingredients, wide shade range and finishes, and no stickiness. Made with 90% natural-origin ingredients, the glosses contain hyaluronic acid and cherry oil for ultimate comfort and promise up to six hours of volume and shine.   But most impressive are the shades, a gorgeous range that spans classic neutrals and bold avant-garde colors. Two intensity options offer both sheer and intense color payoff, so whether your vibe is more clean-girl or vinyl goth glam, you'll be covered. There are also four different finishes—for those who want some extra shine, pearly and holographic will create that '90s-inspired frosted lip look, while classic and intense will make your lips look glassy and plump. And if you loved the minty smell of the Lip Glow Oil, you're in luck: The Addict Lip Maximizer has the same refreshing scent.   We put Dior Addict Lip Maximizer to the test, and these shades are some of Glamour editors' favorites. Scroll to see our honest reviews.   There are a few things that influenced my shade choice. Maybe it's my current obsession with Y2K sparkles, maybe it was Taylor Swift's trippy ""Lavender Haze"" music video. Regardless, this shade makes me so happy. In the tube it reads as extra sparkly and purple, but once applied, it's subtle and sheer with the faintest hint of lavender. You can't tell by the photo, but different lighting brings out the cool blue iridescent flecks—hence the holographic finish. Plus, the packaging makes me feel like I'm a hot mean girl in a rom-com whipping out her fancy lip gloss.     Dior Addict Lip Maximizer Gloss  Dior  Sephora  Ulta  I finally understand why Dior's Lip Maximizer is as popular as it is. Not only does it deliver a Y2K-worthy, high-shine finish without any stickiness—something I'm very weary of (a fly landed on my upper lip and got stuck when I was wearing so much Juicy)—but it plumps your lips ever so slightly without any burning or stinging. The tinted version also gives your pout the perfect pop of pigment for a soft-glam look, making the Maximizer the ideal lip product to keep in your bag or at your desk (which I now do). It's my favorite way to complete a full face of makeup, or feel a bit more put together when going barefaced. TikTok, you did good.    Dior Addict Lip Maximizer Gloss  Dior  I usually stray from a plumping gloss because of the tingling and uncomfortable feeling. However, the Dior Addict Lip Maximizer's ""plumping"" effect tingles but does not hurt at all. The gloss is hydrating, plumps slightly with a minty feel, and looks natural, almost like a clear gloss with a perfect shine for a nice, subtle everyday look.     Dior Addict Lip Maximizer Gloss  Dior  It was love at first sight with Dior's Intense Rosewood, a poetic shade of pink that goes on sheer and gives this just-bitten look that reminds me of Kirsten Dunst's Popsicle-stained lips in The Virgin Suicides. A refreshing tingle stays behind, along with a smooth, lasting sheen you can build on as the day goes by.    Dior Addict Lip Maximizer Gloss  Dior  Ulta  Ariana Yaptangco is the senior beauty editor at Glamour. Follow her on Instagram @arianayap.  "
glamour,dior,Natalie Portman Revived One of the Most Famous Dior Gowns of All Time on the Cannes Carpet,"The 76th Cannes Film Festival has already delivered a slew of breathtaking red-carpet looks, including Elle Fanning's Alexander McQueen ""dress of dreams"" for the opening ceremony and Naomi Campbell's crimson Valentino gown with a pink feathered cape at the Killers of the Flower Moon screening. However, Natalie Portman's arrival at the May December premiere in a glittering custom Dior number that's an ode to a museum piece really captivated die-hard fashion enthusiasts.  The actor's ivory strapless gown—meticulously adorned with ornate beading and featuring a layered skirt reminiscent of a fan of eyeless peacock feathers—is inspired by the Junon dress that Christian Dior himself created for his 1949–1950 autumn-winter collection (named after the Roman goddess, who was wife to Jupiter and patron goddess of Rome). Although it's not currently on display, the original dress is a part of The Metropolitan Museum of Art's Costume Institute collection.  The original Junon gown, on display at the Metropolitan Museum of Art.  While Portman's look—which was dreamt up by Dior's current creative director, Maria Grazia Chiuri—pays homage to the legendary piece, the construction and fabrication of the garment are not identical to the original. This has divided the internet's style watchers, with some praising the reference (""This is insane,"" asserts fashion Twitter account @SaintDoII), and others, like Cherie Balch of Shrimpton Couture, suggesting that certain historic gowns just shouldn't be recreated. (Naturally, the vintage expert advocates for true archive over recreations on the red carpet.)  ""Natalie looked stunning, and her place as a long time ambassador of the house certainly justifies remaking this gown,"" Balch noted on Instagram. ""But, for me, the reproduction pales in comparison—the line is not quite right, the embellishment is less, and the movement didn't have the ease and beauty of the original.""  The dress has been referenced on numerous occasions in the past at Dior, as well as by other design houses. Some of the most notable moments include dresses from John Galliano's spring 2010 haute couture and Grazia Chiuri's spring 2017 haute couture collections at Dior, as well as Zuhair Murad's bespoke scalloped number for British Vogue's June cover star, Miley Cyrus, which she wore to the 2009 Oscars.  This article first appeared on British Vogue.  "
glamour,dior,Jennifer Lawrence Gracefully Recovered After Her Belt Snapped Mid-Speech,"Jennifer Lawrence is known not only for her acting prowess, but also for her light-hearted sense of humor. She's also recognized for her effortlessly chic personal style, which leans heavily on pieces from her favorite luxury brand, The Row (she also happens to be friends with its co-creative directors, Ashley and Mary-Kate Olsen). But when it comes to her appearances on the red carpet, she frequently turns to Dior, thanks to her long-standing ambassadorship. For her most recent appearance, she delivered a laugh-out-loud speech while wearing a sleek outfit by the brand.  During this week's Saks Fifth Avenue and Dior holiday lighting ceremony in New York City, the Hunger Games actor wore a monochromatic ensemble that was, naturally, head-to-toe Dior. Her look included a white button-up shirt, a single-breasted black overcoat cinched at the waist with a skinny belt (more on that below), a pleated black midiskirt, knee-high black velvet boots, and a smart black headband to elegantly secure her hair. To perfect her festive outfit, she accessorized with diamond earrings and a silver chain-link bracelet.  The moment when her belt unexpectedly flew off her waist.  While delivering her speech, there was a brief wardrobe mishap as the star's belt unexpectedly snapped off her waist. However, she handled the situation with professionalism and continued without a hitch. This incident harks back to her 2013 Oscars incident when she stumbled on the stairs wearing a Dior ballgown before accepting her best actress award. We love it when celebrities experience down-to-earth moments—especially when they're dressed in high-fashion attire, just like Jennifer Lawrence.  This article first appeared on British Vogue. "
glamour,versace,Gigi Hadid and Kendall Jenner Led the Supermodel Bonanza at Versace,"As Donatella Versace took her brand's autumn-winter 2023 show to Los Angeles, A-listers and international editors flocked to the West Coast to witness the most seductive of fashions in the flesh. While there were numerous stars on the front row—like Cher, Miley Cyrus, Dua Lipa, Lil Nas X, Paris Hilton, and Anne Hathaway, to name a few—the runway was, naturally, awash with supermodels, both legendary and new-era.   Naomi Campbell at Versace's autumn-winter 2023 show in Los Angeles  Gigi Hadid, who's made headlines recently as the host of Netflix's Next in Fashion second season, opened the show at the Pacific Design Center in West Hollywood wearing a black razor-sharp skirt suit, black leather gloves, stilettos, and a holdall bag (she later wore a breathtaking low-slung gown with sheer corset panels). Elsewhere, Naomi Campbell turned heads as she sashayed in a halter dress, while Emily Ratajkowski delivered optimum femme fatale in a waist-cinching midi slip and leather gloves. To finish it all off, Kendall Jenner closed the show wearing a crystal-embellished minidress with a voluminous capelet and bejeweled neckline.  Emily Ratajkowski at Versace's autumn-winter 2023 show in Los Angeles  Kendall Jenner closes Versace's autumn-winter 2023 show in Los Angeles  Other mega model moments included Adut Akech, Liu Wen, Mariacarla Boscono, Anok Yai, Imaan Hammam, Irina Shayk, and Vittoria Ceretti. It's safe to say that, wherever it may take place in the world, there wouldn't be a Versace show without a swarm of It girls commanding the runway.  This article first appeared on British Vogue. "
glamour,versace,Anne Hathaway Continues Her Bombshell Streak at Versace’s LA Show,"Celebrities like Anne Hathaway were out in full force at Versace's autumn-winter 2023 show in Los Angeles on March 9, despite the last-minute decision to bring it forward by a day due to the weather forecast. Naomi Campbell led a starry supermodel cast on the runway, while Lil Nas X, Miley Cyrus, Ariana DeBose, Elton John, and Dua Lipa lined the front row.   Hathaway, meanwhile, delivered yet another bombshell moment at the event, wearing a croc-embossed minidress, tights, platform boots and sunglasses from Versace, accessorized with Bulgari jewelry.   On the same day, she headed to the Taglyan Complex for the Hollywood Beauty Awards, and picked another Versace LBD to wear on the red carpet. Hathaway opted for a sculpted maxidress that featured a corseted bodice and spiked neckline, stamped with Versace's signature gold Medusa motifs on the straps.   The actor wore another Versace look on the red carpet later that day.   It's the black bralette underneath for me.  By Alexis Gaskin  The actor's two Versace outings succeed a string of head-turning outfits she's worn of late, including the sheer Valentino gown and hooded Alaïa look she wore at the Berlin Film Festival last month. According to Anne Hathaway's stylist, Erin Walsh, the actor's radiant ""glow"" brings her looks to life. ""That doesn't just come from clothes,"" Walsh previously told British Vogue. ""It comes through stepping into your potential and embracing possibility.""    This article first appeared on British Vogue.  "
glamour,versace,Emily Ratajkowski’s Vintage Versace Dress Was Worn by Another It Girl 21 Years Ago,"After her ethereal turn in Tory Burch on the red carpet at the Met Gala, Emily Ratajkowski wore not one but two additional looks to the after-party she hosted with stylist Carlos Nazario, model Paloma Elsesser, Luar designer Raul Lopez, and photographer Renell Medrano.  This content can also be viewed on the site it originates from.  For the initial celebrations, Ratajkowski wore a sheer corseted custom look by Dilara Findikoglu, complete with a pearly, Chanel-inspired belt that read ""EmRata."" But it's her second look—a purple sequined Versace minidress sourced from Archive Vintage—that has created the most buzz on social media.  Emily Ratajkowski wore a vintage Versace dress for the Met Gala after-party she hosted.  Chloë Sevigny wore the same Versace dress in 2002.  The look in question, from Versace's spring-summer 2002 show, was worn by another It girl some 21 years earlier. Chloë Sevigny wore the same dress at the Versace Couture launch party at the Ritz Paris in July 2002—months after its debut on the runway—and shared a throwback picture of herself in the dress on her Instagram Stories, shortly after Ratajkowski posted her look online. Sevigny styled the dress with a very 2002 accessory: a chunky layered necklace.   Emily Ratajkowski has championed vintage Versace before. She wore a look from the Atelier Versace spring-summer 1992 collection to last year's Met, originally modeled by Yasmeen Ghauri on the runway. Besides Versace, her growing vintage wardrobe also includes archive pieces from Chanel, Armani, and Dior.  This article first appeared on British Vogue.  "
